Issue ID,Title,Description, Symptom,Root Cause,Triggering Value,Updating times ,Option Dependency,Issue-URL
150,nginx -t success but nginx -s reload failed,after changing try_files，nginx master segfault,Crash,Improperly handle updated values,Valid,one time,no dependency,https://trac.nginx.org/nginx/ticket/150
945,"when setting master_process off, nginx segmentation fault when sent mutiple HUP singals",changing master_process from off to on，caused segmentation fault,Crash,Improperly handle updated values,Valid,one time,no dependency,https://trac.nginx.org/nginx/ticket/945
1831,ngx_http_perl_module + Perl 5.30.0,"using ngx_http_perl_module, When reloaded(systemctl reload nginx), it becomes segfault",Crash,Improperly handle updated values,Valid,one time,no dependency,https://trac.nginx.org/nginx/ticket/1831
390,Master nginx process segfaults after ~10 config reloads (amazon ami),Master nginx process segfaults after 10 config reloads using ngx_http_perl_module,Crash,Improperly handle updated values,Valid,one time,no dependency,https://trac.nginx.org/nginx/ticket/390
796,nginx.pid is removed during reload if pid path is changed in nginx.conf but points to the same file through a symlink,"if the path to the pid file is changed from /var/run/nginx.pid to /run/nginx.pid in nginx.conf, effectively pointing to the same file on the filesystem, then when the configuration is reloaded the new /run/nginx.pid file is created then destroyed when the old /var/run/nginx.pid is unlinked.
",Functional Error,Fail to consider handling updated values,Valid,one time,no dependency,https://trac.nginx.org/nginx/ticket/796
1419,"The ""worker process is shutting down"" is running all the time, How should I do?",updating he directivesworker_shutdown_timeout is invalid,Functional Error,Improperly handle updated values,Valid-drastically,one time,no dependency,https://trac.nginx.org/nginx/ticket/1419
178,listen with ssl but missing ssl_certificate is not detected by nginx -t,"updating ""listen 443 ssl"", makes system failed all HTTPS requests",Functional Error,Improperly handle updated values,Valid,one time,dependency,https://trac.nginx.org/nginx/ticket/178
